{
  "version": "v0",
  "generated_at": "2026-02-23T18:30:00.000Z",
  "total": 2,
  "items": [
    {
      "kit_id": "kit_incident_commander",
      "name": "Incident Commander",
      "description": "Incident-first agent kit optimized for triage, evidence collection, and approved outbound updates.",
      "role": "incident_commander",
      "default_policy_profile": "polprof_ops_standard",
      "default_playbook_id": "pbk_incident_triage",
      "capability_goals": [
        "message.send",
        "calendar.read",
        "doc.read",
        "tool.list",
        "tool.read",
        "delegation.request",
        "delegation.status"
      ],
      "connector_candidates": [
        {
          "connector_id": "con_feishu_official",
          "required_capabilities": [
            "message.send",
            "doc.read"
          ],
          "optional_capabilities": [
            "calendar.read"
          ],
          "risk_profile": "restricted"
        },
        {
          "connector_id": "con_mcp_gateway",
          "required_capabilities": [
            "tool.list",
            "tool.read"
          ],
          "optional_capabilities": [
            "tool.invoke"
          ],
          "risk_profile": "high_control"
        }
      ],
      "rollout": [
        {
          "phase_id": "phase_triage",
          "title": "Triage",
          "focus": "Read incident context and summarize evidence into a deterministic timeline.",
          "approval_expectation": "none"
        },
        {
          "phase_id": "phase_notify",
          "title": "Notify",
          "focus": "Send stakeholder updates through approval-gated outbound message actions.",
          "approval_expectation": "single"
        }
      ]
    },
    {
      "kit_id": "kit_office_ops_core",
      "name": "Office Ops Core",
      "description": "Baseline office operations agent with policy-first messaging, docs, calendar, and bridge controls.",
      "role": "ops_assistant",
      "default_policy_profile": "polprof_ops_standard",
      "default_playbook_id": "pbk_weekly_ops_sync",
      "capability_goals": [
        "message.send",
        "calendar.read",
        "doc.read",
        "doc.write",
        "tool.list",
        "tool.read",
        "tool.invoke",
        "delegation.request",
        "delegation.status"
      ],
      "connector_candidates": [
        {
          "connector_id": "con_feishu_official",
          "required_capabilities": [
            "message.send",
            "doc.read"
          ],
          "optional_capabilities": [
            "doc.write",
            "calendar.read"
          ],
          "risk_profile": "restricted"
        },
        {
          "connector_id": "con_office_calendar",
          "required_capabilities": [
            "calendar.read"
          ],
          "optional_capabilities": [
            "calendar.write"
          ],
          "risk_profile": "standard"
        },
        {
          "connector_id": "con_a2a_gateway",
          "required_capabilities": [
            "delegation.request",
            "delegation.status"
          ],
          "optional_capabilities": [
            "delegation.cancel"
          ],
          "risk_profile": "high_control"
        }
      ],
      "rollout": [
        {
          "phase_id": "phase_observe",
          "title": "Observe First",
          "focus": "Enable read/list/status capabilities and build trust with zero side effects.",
          "approval_expectation": "none"
        },
        {
          "phase_id": "phase_coordinate",
          "title": "Coordinate",
          "focus": "Enable controlled write/send capabilities with human approval checkpoints.",
          "approval_expectation": "single"
        }
      ]
    }
  ]
}
